repo_name,description,owner,owner_location,topic,url,num_stars,num_forks
genre_game,"Letting a neural network classify genres by song titles is not too hard, but how good are humans at that? This app aims to find out!",Tobias,Bremen,[],https://github.com/MarauderPixie/genre_game.git,1,0
F1-Bot-Grand-Prix,A neural network that is trained to successfully drive a lap on any track in the Nintendo 64 game F1 World Grand Prix. So far it doesn't do it :D,Janu,TU Dresden,[],https://github.com/ezBeanie/F1-Bot-Grand-Prix.git,1,0
Cpp-Evolution,"Evolution Simulator made with C++, Sfml and Eigen. I made this project for learning structured workflows in C++, how to compile bigger projects with library imports (SFML) and how to structure code intern stuff like classes, configuration variables and shared variables between multiple classes and threads. I also included neural networks.",,Oldenburg,[],https://github.com/D-Niermann/Cpp-Evolution.git,1,0
CIFAR-10-CS4487-Assignment,Final project of my Course Machine Learning CS4487 as exchange student at the City University of Hongkong.,Tim Löhr,Erlangen,"['cifar10', 'cityuniversityofhongkong', 'python', 'deeplearning', 'machine-learning', 'vgg16']",https://github.com/Mavengence/CIFAR-10-CS4487-Assignment.git,1,0
Predicting_bike_rental_demand,"My first ai project as part of my take on the amazing online course ""Introduction to Machine Learning for Coders"" taught by Jeremy Howard. I will be contributing to the Kaggle competition ""Bike Sharing Demand"", aiming to predict bike rental demand depending on the weather.",Henrike Schwenn,Hamburg,"['anaconda3', 'fastai', 'bike', 'rental', 'prediction-model', 'random-forest', 'kaggle-competition', 'python3', 'jupyter-notebook', 'ubuntu', 'first-project', 'ai', 'introduction-to-machine-learning']",https://github.com/henrike-94/Predicting_bike_rental_demand.git,1,0
QuadrupedControl,Arduino Library for controlling a mePed robot V2 with 8 servos using an IR remote.,Armin,Cologne,[],https://github.com/ArminJo/QuadrupedControl.git,1,0
bagel_magic,Wizard to manage Bagel models associated with robot modes of MARS simulation.,DFKI Robotics Innovation Center,Bremen,[],https://github.com/dfki-ric/bagel_magic.git,1,0
vdm,VDM (visualization-of-dynamical-model): RoboCup project visualizing acting forces on arbitrary urdf-robot-models in rviz.,,Hamburg,[],https://github.com/nalchevanidze/vdm.git,1,0
RelayRacingCode,Flag Carrying Race with Robots,Batu Kaan Özen,Ulm area,"['astaralgrotihm', 'globalcameraimageprocessing', 'rasspberry-pi', 'orangepi', 'opencv']",https://github.com/btknzn/RelayRacingCode.git,1,0
robot-react-app,A sample UI to control a robot,Florian Hiensch,"DE, Saarland",[],https://github.com/FHiensch/robot-react-app.git,1,0
robot-react-app,A sample UI to control a robot,Florian Hiensch,"DE, Saarland",[],https://github.com/FHiensch/robot-react-app.git,1,0
kdl_parser,Create PyKDL chains from URDF robot descriptions,Julian,Cologne,[],https://github.com/jvytee/kdl_parser.git,1,0
kdl_parser,Create PyKDL chains from URDF robot descriptions,Julian,Cologne,[],https://github.com/jvytee/kdl_parser.git,1,0
Trainable-Object-detection-System-,Trainable Object Detection system ( part for line following robot with camera),Batu Kaan Özen,Ulm area,[],https://github.com/btknzn/Trainable-Object-detection-System-.git,1,0
Nao_Kinect_RNN_Motion_Adaption,"Bachelor Project. Kinect user motion is mirrowed to humanoid Nao roboter. With C++ RNN impletation to learn motion trajectories. Requires Naoqi C++ SDK, OpenNi and Nite2",Christian Breiderhoff,Bonn,[],https://github.com/cbreider/Nao_Kinect_RNN_Motion_Adaption.git,1,1
imitation-learning,"An implementation of the paper ""Learning and Reproduction of Gestures by imitation"" from Calinon et al.  The algorithm proposed in the paper is tested on the Baxter Robot using rai for control.",Marc Tuscher,Stuttgart,"['baxter', 'imitation-learning', 'hmm', 'gmm', 'robotics', 'rai', 'ros']",https://github.com/marctuscher/imitation-learning.git,1,1
SpeedLimit_DL,A deep learning project to estimate the current speedlimit from a front camera video feed.,,Freiburg im Breisgau,[],https://github.com/ricardoschwarz/SpeedLimit_DL.git,1,0
Deep_Learning_Codes,Deep Learning Codes,Zhecheng Wang,01069 Dresden,[],https://github.com/ZhechengWang2018/Deep_Learning_Codes.git,1,0
painter-by-numbers,Deep Learning on Kubeflow,Iurii Mozzhorin,Frankfurt am Main,[],https://github.com/mozzhorin/painter-by-numbers.git,1,0
Feed-Forward-Neural-Network,A small C++ feed forward neural network using backpropagation written with the Eigen3 library.,Constantin Ruhdorfer,Stuttgart,[],https://github.com/ConstantinRuhdorfer/Feed-Forward-Neural-Network.git,1,0
Bachelor-Thesis-Textgeneration-TH.OHM,IT-Based textgeneration with the use of NLP methods. A text summarization task is conducted with the amazon fine food review dataset from Kaggle. This task is done by attention and lstm neural networks.,Tim Löhr,Erlangen,"['bachelor-thesis', 'prototype', 'textgeneration', 'nlp', 'attention-mechanism', 'lstm-neural-networks']",https://github.com/Mavengence/Bachelor-Thesis-Textgeneration-TH.OHM.git,1,1
Bachelor-Thesis-Textgeneration-TH.OHM,IT-Based textgeneration with the use of NLP methods. A text summarization task is conducted with the amazon fine food review dataset from Kaggle. This task is done by attention and lstm neural networks.,Tim Löhr,Erlangen,"['bachelor-thesis', 'prototype', 'textgeneration', 'nlp', 'attention-mechanism', 'lstm-neural-networks']",https://github.com/Mavengence/Bachelor-Thesis-Textgeneration-TH.OHM.git,1,1
AWS-SageMaker,Machine learning in the cloud with AWS SageMaker.,Timo Meiendresch,Cologne [GER],[],https://github.com/tm1611/AWS-SageMaker.git,1,1
dashboard-master,Vue.js Project that displays live Machine-Learning Prediction Data via Chart.js,Arvid Strauß,Dresden,[],https://github.com/ArvidStrauss/dashboard-master.git,1,0
Clustering-KMeans-Python-IS4861-Assignment,Clustering Assignment of my Course Machine Learning for Business IS4681 as exchange student at the City University of Hongkong.,Tim Löhr,Erlangen,[],https://github.com/Mavengence/Clustering-KMeans-Python-IS4861-Assignment.git,1,0
Supervised-Machine-Learning,Supervised machine learning examples. ,Timo Meiendresch,Cologne [GER],[],https://github.com/tm1611/Supervised-Machine-Learning.git,1,0
CV2DataSetLabeler,Label data sets for machine learning with a customizable UI written in Python CV2,Lukas Sabatschus,Bonn,[],https://github.com/luksab/CV2DataSetLabeler.git,1,0
robot_tracking,Code and documentation for the task of tracking a robot using Computer Vision ,Anirudh NJ,Bonn,"['aruco-markers', 'tracking', 'opencv', 'lego-nxt']",https://github.com/njanirudh/robot_tracking.git,4,0
android-speaker-identification,:iphone: prototypical android app for voice-based user identification on :robot: Loomo by @Segway-Robotics,Vincent Thiele,Dresden,"['hri', 'user-identification', 'adaptability', 'speech-recognition', 'machine-learning', 'neural-network', 'ai', 'android', 'loomo']",https://github.com/vvvt/android-speaker-identification.git,2,1
homer_robot_face,A ros package for visualizing a robot face with different facial expressions,homer,Koblenz,[],https://github.com/homer-robotics/homer_robot_face.git,2,3
Line-Following-Robot-with-Camere-OpenCV-and-PID-mplementation-and-improvin-PID-value-with-AI-,Aim of this project making one Robotic system which can follow line with Camera and this system is going to train itself to find Best PID Value with Mashine learning for each line kind.,Batu Kaan Özen,Ulm area,[],https://github.com/btknzn/Line-Following-Robot-with-Camere-OpenCV-and-PID-mplementation-and-improvin-PID-value-with-AI-.git,2,0
Multi-Body-Dynamics-Engine,"Repository for the course ""Computational Dynamics for Robotics"" at University of Stuttgart",Lucas Rath,Stuttgart,"['university-of-stuttgart', 'multi-body-dynamics', 'physics-engine', 'mechanical-engineering', 'control-engineering', 'simulation', 'modelling']",https://github.com/lucasrm25/Multi-Body-Dynamics-Engine.git,3,3
