repo_name,description,owner,owner_location,topic,url,num_stars,num_forks
Generation-of-Training-Data-for-Deep-Learning,A resource repository for generation of training data for deep learning.,Pascal Loth,Hamburg,[],https://github.com/ploth/Generation-of-Training-Data-for-Deep-Learning.git,19,0
pyblaze,Large-Scale Machine and Deep Learning in PyTorch.,Oliver Borchert,Munich,"['pytorch', 'deep-learning', 'machine-learning']",https://github.com/borchero/pyblaze.git,12,1
bonnetal,"Bonnet and then some! Deep Learning Framework for various Image Recognition Tasks. Photogrammetry and Robotics Lab, University of Bonn",Photogrammetry & Robotics Bonn,Bonn,"['ros', 'cnn', 'semantics', 'detection', 'classification', 'features', 'imageprocessing', 'computervision']",https://github.com/PRBonn/bonnetal.git,189,48
Supervised-Machine-Learning,Supervised machine learning examples. ,Timo Meiendresch,Cologne [GER],[],https://github.com/tm1611/Supervised-Machine-Learning.git,1,0
Stanford-Project-Predicting-stock-prices-using-a-LSTM-Network,"Stanford Project: Artificial Intelligence is changing virtually every aspect of our lives. Today’s algorithms accomplish tasks that until recently only expert humans could perform. As it relates to finance, this is an exciting time to adopt a disruptive technology that will transform how everyone invests for generations.  Models that explain the returns of individual stocks generally use company and stock characteristics, e.g., the market prices of financial instruments and companies’ accounting data. These characteristics can also be used to predict expected stock returns out-of-sample. Most studies use simple linear models to form these predictions [1] or [2]. An increasing body of academic literature documents that more sophisticated tools from the Machine Learning (ML) and Deep Learning (DL) repertoire, which allow for nonlinear predictor interactions, can improve the stock return forecasts [3], [4] or [5].  The main goal of this project is to investigate whether modern DL techniques can be utilized to more efficiently predict the movements of the stock market. Specifically, we train a LSTM neural network with time series price-volume data and compare its out-of-sample return predictability with the performance of a simple logistic regression (our baseline model).",David Dümig,Frankfurt am Main,[],https://github.com/dduemig/Stanford-Project-Predicting-stock-prices-using-a-LSTM-Network.git,68,18
Lecture_AI_in_Automotive_Technology,"This is the github Repository that belongs to the lecture ""Artificial Intelligence in Automotive Technology"" from the Institute of Automotive Technology of the Technical University of Munich",TUM - Institute of Automotive Technology,Munich,[],https://github.com/TUMFTM/Lecture_AI_in_Automotive_Technology.git,39,13
robot_tracking,Code and documentation for the task of tracking a robot using Computer Vision ,Anirudh NJ,Bonn,"['aruco-markers', 'tracking', 'opencv', 'lego-nxt']",https://github.com/njanirudh/robot_tracking.git,4,0
Flowers,A small Flask app for uploading and classifying images with PyTorch or IBM Watson Visual Recognition and writing predictions to a SQL database,Christoph Schauer,Munich,"['pytorch', 'transfer-learning', 'convolutional-neural-networks', 'deep-learning', 'python', 'flask', '102-category-flower-dataset', 'sqlalchemy', 'sqlserver', 'watson-visual-recognition']",https://github.com/chrisssch/Flowers.git,1,0
anki_description,Universal Robot Description for Anki Robots,Marton Juhasz,Hamburg,[],https://github.com/nilseuropa/anki_description.git,9,1
AudioPouring,Making Sense of Audio Vibration for Liquid Height Estimation in Robotic Pouring,Hongzhuo Liang,Hamburg,[],https://github.com/lianghongzhuo/AudioPouring.git,5,5
multipolar,Multi-Source Policy Aggregation for Transfer Reinforcement Learning between Diverse Environmental Dynamics,Mohammadamin Barekatain,Munich,[],https://github.com/Mohammadamin-Barekatain/multipolar.git,3,4
Visual-Explanation-in-Deep-Reinforcement-Learning,"This project visualizes the knowledge of an agent trained by Deep Reinforcement Learning (paper will be published) using Backpropagation, Guided Backpropagation, GradCam and Guided gradCam. It shows why the agent is performing the action. Which pixels had the biggest influence on the decision of the agent.",Mateus,"German, Bremen",[],https://github.com/Mateus224/Visual-Explanation-in-Deep-Reinforcement-Learning.git,3,0
reinforcement-learning-2,This repository contains the code to the corresponding blog post: Reinforcement learning – Part 2: Getting started with Deep Q-Networks.,Philip Ossenkopp,Hanover,[],https://github.com/phossen/reinforcement-learning-2.git,2,2
deep_rl_nanodegree,Project Solutions for my Deep Reinforcement Learning Nanodegree at Udacity,Marcel Kurovski,Cologne,"['reinforcement-learning', 'deep-reinforcement-learning', 'actor-critic-algorithm', 'gym', 'unity']",https://github.com/mkurovski/deep_rl_nanodegree.git,2,0
papers,computer vision papers / benchmarks and other resources,Alexey Abramov,"Munich, Bavaria",[],https://github.com/aabramovrepo/papers.git,2,1
Computer-Vision,"Repository for the course ""Computer Vision"" and ""Correspondence Problems in Computer Vision"" at University of Stuttgart",Lucas Rath,Stuttgart,"['computer-vision', 'computer-science', 'university-of-stuttgart']",https://github.com/lucasrm25/Computer-Vision.git,1,2
Computer-Vision-I,Exercises for my master degree Computer Vision 1 module.,Ilyass Taouil,"Bonn, DE",[],https://github.com/itaouil/Computer-Vision-I.git,1,0
cv2_saliency_prediction,Computer Vision 2 Project at Uni Hamburg,Florian Schneider,Hamburg,[],https://github.com/floschne/cv2_saliency_prediction.git,1,0
CarND-LaneLines-P2,"Advanced Lane Finding project from the Udacity's Self Driving Car Engineer NanoDegree. Here, further computer vision techniques (calibration, color space transformation, thresholding etc.) are used for image transformation and lane marking detection under challenging light conditions. Then, road parameters are estimated and tracked over the whole video sequence.",Artem,Ingolstadt,[],https://github.com/artemkaliuk/CarND-LaneLines-P2.git,1,0
trading_rl,the project contains an environment and agent to use deep reinforcement learning in trading. the environment uses the quant connect API in python,Maurizio,Munich,[],https://github.com/localhorst87/trading_rl.git,4,2
kaos,open source platform for simplifying machine learning deployment,KI labs GmbH,Munich,"['ml', 'platform', 'kaos', 'terraform', 'kubernetes', 'pachyderm', 'python', 'cloud-agnostic']",https://github.com/KI-labs/kaos.git,85,7
machine-learning-applied-to-cfd,Examples of how to use machine learning algorithms in computational fluid dynamics.,Andre Weiner,Braunschweig,[],https://github.com/AndreWeiner/machine-learning-applied-to-cfd.git,73,25
machine-learning-interactive-visualization,Interactive visualization of machine learning model evaluation metrics,Dominik Haitz,Hamburg,"['machine-learning', 'jupyter-notebook', 'voila', 'dashboard', 'python', 'matplotlib', 'seaborn']",https://github.com/dhaitz/machine-learning-interactive-visualization.git,40,7
Machine-Learning-Engineer-Nanodegree,"Notes and material for the ""Machine Learning Engineer Nanodegree"" (MLND) by Udacity.",Timo Meiendresch,Cologne [GER],[],https://github.com/tm1611/Machine-Learning-Engineer-Nanodegree.git,30,10
ML-Navigator,Open source tutorial-based Machine Learning framework,KI labs GmbH,Munich,[],https://github.com/KI-labs/ML-Navigator.git,15,1
constant_velocity_pedestrian_motion,"Code for ""What the Constant Velocity Model Can Teach Us About Pedestrian Motion Prediction"", Schöller et al., Robotics and Automation Letters (RA-L), 2020",Christoph Schöller,Munich,[],https://github.com/cschoeller/constant_velocity_pedestrian_motion.git,22,6
i_see_pee,icp based robot localization,Dima Dorezyuk,Munich,"['icp', 'ros', 'localization', 'agv', 'robotics']",https://github.com/dorezyuk/i_see_pee.git,14,7
calibration-framework,Python Framework to calibrate confidence estimates of classifiers like Neural Networks,Fabian Küppers,Bottrop,[],https://github.com/fabiankueppers/calibration-framework.git,40,8
imd,"Code for MSID, a Multi-Scale Intrinsic Distance for comparing generative models, studying neural networks, and more!",Anton Tsitsulin,Bonn,[],https://github.com/xgfs/imd.git,38,3
3dMRISegmentation,"Code for NeuroImage: Clinical paper ""Automatic post-stroke lesion segmentation on MR images using 3D residual convolutional neural network.""",Biomedical Informatics Research and Data Science @ Dartmouth,"Hanover, NH","['ischemic-stroke', 'segmentation', 'mri', 'medical-image-analysis', 'pytorch', '3d-resnet']",https://github.com/BMIRDS/3dMRISegmentation.git,11,4
gnn-pretraining-evaluation,"Can Graph Neural Networks Go ""Online""? An Analysis of Pretraining and Inference",Lukas Galke,Kiel,[],https://github.com/lgalke/gnn-pretraining-evaluation.git,11,1
Artificial-Intelligence-IN2062,Solutions to programming exercises of Artificial Intelligence course @TUM #Python #Java,Pınar Kaymaz,Munich,"['python', 'tum', 'java', 'artifical-intelligence', 'knowledge-base', 'search-algorithm', 'depth-first-search', 'astar-search-algorithm', 'inference-engine']",https://github.com/pinarkaymaz6/Artificial-Intelligence-IN2062.git,1,0
ai-master-thesis,"Submitted Files for Master Thesis ""The Portrayal of Artificial Intelligence in Science Fiction Literatur"" FSS19",Larissa Haas,Heidelberg,[],https://github.com/LarissaHa/ai-master-thesis.git,1,0
SER-datasets,A collection of datasets for the purpose of emotion recognition/detection in speech.,Ayoub Malek,Munich,"['speech-emotion-recognition', 'emotional-speech-databases', 'databases', 'emotions', 'speech', 'emotions-recognition', 'datasets', 'multimodal-emotion-recognition', 'iemocap-emotion']",https://github.com/SuperKogito/SER-datasets.git,7,1
KayMo,Facial and Speech Emotion Recognition 🔊💗👀🎭🎶,Amr Kayid,Munich,[],https://github.com/AmrMKayid/KayMo.git,1,1
DeepVisual,Reconstruct visual stimuli from EEG data using Deep Learning,Stefan,"Munich, DE","['eeg', 'eeg-analysis', 'machine-learning', 'brainweb']",https://github.com/stefanches7/DeepVisual.git,3,2
2019_DL,2019 Deep Learning Summary,Shaohang,Karlsruhe,[],https://github.com/ClaytonStudent/2019_DL.git,2,1
cn24-active,"Code for ""Active Learning for Deep Object Detection""",Computer Vision Group Jena,Jena,[],https://github.com/cvjena/cn24-active.git,2,1
DeepLearningResources,This repository contains links to useful deep learning resources to get started with the topic or gain insight into specific topics,Health Hackers e.V.,Erlangen,[],https://github.com/healthhackersER/DeepLearningResources.git,2,1
BRAN,BRAN (Basic Recognition and Authentication at eNtrance) - A Facial recognition based identification & authentication system mounted at KI labs office entrance in Munich (https://www.ki-labs.com),KI labs GmbH,Munich,"['facial-recognition', 'raspberry-pi-3', 'opencv', 'python', 'picamera', 'hog-features-extraction', 'cnn-for-visual-recognition']",https://github.com/KI-labs/BRAN.git,9,1
exploring_hybrid_ctc_attention_asr,"Source Code for ""Exploring Hybrid CTC/Attention End-to-End Speech Recognition with Gaussian Processes""",Ludwig Kürzinger,Munich,[],https://github.com/lumaku/exploring_hybrid_ctc_attention_asr.git,4,1
nlp-with-actions,Natural Language Processing With Actions,michael spengler,Heidelberg,[],https://github.com/michael-spengler/nlp-with-actions.git,2,0
nlp_notebooks,"Jupyter Notebooks for the course ""Natural Language Processing in Python""",Matthias Aßenmacher,Munich,[],https://github.com/assenmacher-mat/nlp_notebooks.git,2,0
source-separation,Audio Source separation based on deep learning,Tapan Sharma,Munich,[],https://github.com/t6nand/source-separation.git,7,2
lais-learning-analytics-1819,"Learning Analytics Insights is a Project developed as a part of Learning Analytics lecture(WS 18/19), taught by Prof. Dr. Mohamed Chatti at University of Duisburg Essen. The R based application can be used for predicting student grades (based on inputs taken from a Survey and an open source data set) and for visualizing the results.",Ankita Mandal,Munich,[],https://github.com/ankitaMandal/lais-learning-analytics-1819.git,2,0
elaugment,A lightweight data-augmentation library for machine learning,Tim Joseph,Karlsruhe,"['augmentation', 'data-augmentation', 'machine-learning', 'reproducibility', 'random', 'deterministic', 'flip', 'crop', 'resize', 'elastic', 'affine', 'rotate', 'color', 'contrast', 'python', 'image-augmentation', 'image-segmentation', 'deep-learning']",https://github.com/mctigger/elaugment.git,4,0
ML-Tutorial,Introduction to Machine Learning using scikit-learn and PyTorch,Visual Learning Lab Heidelberg,Heidelberg,[],https://github.com/VLL-HD/ML-Tutorial.git,8,0
soil-texture-processing,Tools to generate training and classification data for machine learning purposes from multispectral Sentinel-2 satellite images.,Oliver Sefrin,Karlsruhe,"['sentinel-2', 'gdal', 'dataset-split', 'geopandas', 'rasterio', 'classification', 'machine-learning', 'multispectral']",https://github.com/oliversefrin/soil-texture-processing.git,5,1
am-segmentation,Imaging mass spectrometry ablation mark segmentation with convolutional neural networks.,Vitaly Kovalev,Heidelberg,"['deep-learning', 'unet', 'convolutional-neural-networks', 'pytorch']",https://github.com/intsco/am-segmentation.git,3,0
clusternet_segmentation,Unsupervised Segmentation by applying K-Means clustering to the features generated by Neural Network,Andrii Zhygallo,Munich,[],https://github.com/zhygallo/clusternet_segmentation.git,2,2
PySORN_0.1,Use cases and API for Self -Organizing Recurrent Neural Networks,Saranraj Nambusubramaniyan,Heidelberg,"['neuroscience', 'neurocomputing', 'spiking-cortical-model', 'artificial-general-intelligence', 'neural-coding', 'neuro-inspired', 'neuroplasticity']",https://github.com/Saran-nns/PySORN_0.1.git,2,0
sEMG-Rock-Paper-Scissors,sEMG Classification into Hand Gestures using a Convolutional Neural Network.,Lukas Goll,Munich,[],https://github.com/redwerefox/sEMG-Rock-Paper-Scissors.git,2,0
candidate_training,"Reproducible version of the experiments in ""Leveraging inductive bias of neural networks for learning without explicit human annotations""",Machine Learning and Information Processing Laboratory,TU Munich / Rice University,[],https://github.com/MLI-lab/candidate_training.git,2,0
MCTML_Light,"Code for Master thesis ""AutoML with Monte Carlo Tree Search and Neural Network""",Shaohang,Karlsruhe,['automl'],https://github.com/ClaytonStudent/MCTML_Light.git,2,1
railway_detection,"Segmentation Neural Network for railway detection. The task is to program a track detection method for railway, i.e. an automatic detection of the ego-track of a locomotive with an on-board camera and marking it with a red line (e.g. on the center or on both rails).",Nana Baah,Hamburg,"['python', 'keras', 'tensorflow', 'cnn', 'segmentation', 'neural-networks', 'deep-learning', 'machine-learning', 'opencv']",https://github.com/nanaBaah/railway_detection.git,2,1
autonomous_car_simulation,Pytorch model (CNN) to drive a simulated car autonomously in the Udacity Self-Driving Car Simulation. ,Patrick Gebert,Karlsruhe,"['machine-learning', 'pytorch', 'python', 'cnn', 'regression', 'self-driving-car', 'udacity-self-driving-car']",https://github.com/pgebert/autonomous_car_simulation.git,5,3
donkey_car_button_SHIM,Use the PIMORONI button SHIM to start the Donkey Car training mode or self-driving mode as you like.,Ingmar Stapel,Munich,[],https://github.com/custom-build-robots/donkey_car_button_SHIM.git,3,3
CarND-E2E_Autonomous_Navigation,"Programming a real self driving car: Detecting and stopping at traffic lights, respecting speed limits, jerk and acceleration limits. ",azzouz marouen,Stuttgart,"['autonomous-driving', 'ros', 'traffic-sign-classification', 'self-driving-car', 'computer-vision']",https://github.com/mmarouen/CarND-E2E_Autonomous_Navigation.git,2,0
Simulated_SelfDriving_Car,Self-driving car using the Udacity driving simulator,Karsten Roth,Heidelberg,"['autonomous-vehicles', 'autonomous-driving', 'udacity-self-driving-car', 'pytorch', 'udacity', 'simulator', 'convolutional-neural-networks']",https://github.com/Confusezius/Simulated_SelfDriving_Car.git,1,1
Opencv-project,Road lane line detection using Opencv for self driving cars!,Mahesh Basavanahalli Sanjeevamurthy,Bremen,[],https://github.com/Mahesh-gowda/Opencv-project.git,1,0
CarND-LaneLines-P1-master,First project on lane markings detection and lane finding from the Udacity's Self-Driving Car Engineer Nanodegree,Artem,Ingolstadt,[],https://github.com/artemkaliuk/CarND-LaneLines-P1-master.git,1,0
dpg2019-ml-tutorial,"A 3-hour Tutorial on Machine Learning, to be given at the DPG Spring Meeting 2019 in Aachen",Astroparticle Physics TU Dortmund,Dortmund,[],https://github.com/tudo-astroparticlephysics/dpg2019-ml-tutorial.git,3,0
Kaggle-Seattle-Airbnb-Analysis-IS4861-Assignment,Final project of my Course Machine Learning for Business IS4681 as exchange student at the City University of Hongkong.,Tim Löhr,Erlangen,"['course', 'kaggle-dataset', 'seattle', 'city-university-of-hongkong', 'data-analysis', 'business']",https://github.com/Mavengence/Kaggle-Seattle-Airbnb-Analysis-IS4861-Assignment.git,3,1
1910-geekettes-DataScienceWorkshop,"In this hands-on tutorial, we will go through the characteristic steps of a typical machine learning project.",Lydia Nemec,Munich,[],https://github.com/lnemec/1910-geekettes-DataScienceWorkshop.git,3,0
hodor_face_recognition,A simple face recognition using OpenCV and Python,Riswan,Munich,[],https://github.com/rayoriz/hodor_face_recognition.git,1,0
FacyReact,A face recognition game for mobile computing (KIT),David Laubenstein,Karlsruhe,[],https://github.com/rocklyve/FacyReact.git,1,1
EdgeNet,A simple Convolutional Neural Network to find edges of images using Canny edge detector result as ground truth,Mohammad Doosti Lakhani,Saarland - Deutschland,"['cnn', 'pytorch', 'places365', 'canny-edge-detection', 'image-processing', 'canny-edges-detection', 'canny', 'cannyedge']",https://github.com/Nikronic/EdgeNet.git,8,0
photils-android,"Android application that tries to predict keywords based on the selected image. The application passes a selected image through a neural network, classifies it, and extracts the suggested tags. Everything happens offline without the need that your data are sent over the internet.",Tobias Scheck,Chemnitz,"['android', 'android-application', 'machine-learning', 'tensorflow-lite', 'tensorflow', 'hashtagaggregator', 'hashtag', 'instagram-hashtag', 'keyword', 'imageprocessing']",https://github.com/scheckmedia/photils-android.git,5,0
Deep-Metric-Learning-Baselines,PyTorch Implementation for Deep Metric Learning Pipelines,Karsten Roth,Heidelberg,"['pytorch', 'deep-metric-learning', 'deep-learning', 'metric-learning', 'neural-networks', 'computer-vision', 'pku-vehicle', 'distance-sampling', 'shop-clothes', 'cars196', 'cub200']",https://github.com/Confusezius/Deep-Metric-Learning-Baselines.git,409,77
RNN-for-Time-Series,Recurrent neural network (RNN) methods for time series forecasting ,Timo Meiendresch,Cologne [GER],[],https://github.com/tm1611/RNN-for-Time-Series.git,4,3
in2364-adl4cv,Video Object Segmentation using Graph Neural Networks,Christoph Clement,Munich,"['video-object-segmentation', 'graph-neural-networks', 'pytorch-geometric', 'davis-challenge', 'osvos-pytorch']",https://github.com/chris-clem/in2364-adl4cv.git,4,1
ConvNetTikzPlot,Tool to plot the scematics of an convolutional/dense architecture of a neural network in Tikz,Sascha,Bielefeld,"['convolutional-neural-networks', 'tikz-figures', 'latex', 'deep-learning', 'visualization', 'documentation']",https://github.com/tutlum/ConvNetTikzPlot.git,4,1
sorn,PyPi Package of Self Organizing Recurrent Neural Networks (SORN),Saranraj Nambusubramaniyan,Heidelberg,"['neuroinformatics', 'neuro-computing', 'artificial-intelligence', 'cortical-network', 'cortical-learning', 'reinforcement-learning', 'autonomous-agents', 'brain-inspired-computing', 'self-organizing-network', 'memory-network', 'sorn', 'complex-networks', 'neuroplasticity', 'hebbian-learning', 'bolzmann-machines', 'reservoir-computing', 'hopfield-network', 'self-organizing-criticality', 'point-neurons']",https://github.com/Saran-nns/sorn.git,4,0
Wavelet-network-compression,A PyTorch implementation for Neural Network compression with learnable wavelets.  The corresponding paper titled 'Neural Network compression via learnable wavelet transforms' appeared at ICANN 2020.,Moritz Wolter,Bonn,[],https://github.com/v0lta/Wavelet-network-compression.git,4,1
reinforcement-learning-and-quantum-simulations,Reinforcement learning applied to digital quantum simulations,Adrien Bolens,Dresden,[],https://github.com/adrienbolens/reinforcement-learning-and-quantum-simulations.git,10,2
maml-rl-tf2,Implementation of Model-Agnostic Meta-Learning (MAML) applied on Reinforcement Learning problems in TensorFlow 2.,Moritz Schneider,Aachen,"['maml-rl', 'reinforcement-learning', 'paper', 'meta-learning', 'maml', 'meta-reinforcement', 'meta-rl', 'tensorflow2']",https://github.com/MoritzTaylor/maml-rl-tf2.git,10,1
machine-learning-overview,A collection of modern machine learning development,Andrew Huang,Dresden,[],https://github.com/epadam/machine-learning-overview.git,2,0
NumPy-backprop,Numpy implementations of feedforward and recurrent machine learning network structures.,Moritz Wolter,Bonn,"['numpy', 'backpropagation']",https://github.com/v0lta/NumPy-backprop.git,2,0
stau_learning,Deep learning for stau,Leonid Didukh,Hamburg,[],https://github.com/bdtmnk/stau_learning.git,1,0
alfons_robot_bringup,main bringup package for alfons robot,Markus Lamprecht,Darmstadt,[],https://github.com/CesMak/alfons_robot_bringup.git,1,0
NaoV6,A collection of good-to-know knowledge for the NaoV6 Robot in the Robocup context.,HULKs,Hamburg University of Technology,[],https://github.com/HULKs/NaoV6.git,1,0
SciML,Machine learning for Engineering applications,Truong-Vinh Hoang,Aachen,[],https://github.com/vinh-tr-hoang/SciML.git,2,0
Machine-Learning-Exercise,Just as a document for my homework exercise in machine learning. Maybe there are some mistakes.,yulian sun,Technishce Universität Darmstadt,[],https://github.com/smallsmallstrong/Machine-Learning-Exercise.git,2,0
Machine-Learning---Option-Pricing-Calibration-Hedging--,"Material for the workshop Machine Learning for Option Pricing, Calibration and Hedging",Joerg Kienitz,Bonn,[],https://github.com/Lapsilago/Machine-Learning---Option-Pricing-Calibration-Hedging--.git,2,1
graph_confrec,Conference recommender system based on graph neural networks,Andreea Iana,Mannheim,[],https://github.com/andreeaiana/graph_confrec.git,1,0
Pattern-Recognition,This project made with MATLAB. It's about machine learning. Artificial Neural Network in the form of Multilayer Perceptron.,Hüseyin Hürkan KARAMAN,"Bonn, Deutschland","['matlab', 'machine-learning-algorithms', 'pattern-recognition', 'backpropagation-learning-algorithm', 'backpropagation', 'artifical-neural-network', 'multilayer-perceptron-network', 'multilayer-perceptron']",https://github.com/maxmanus96/Pattern-Recognition.git,1,0
Tumor-Identification-Python,Deep Neural Network,Koushik Chowdhury,"Kirkel, Saarland",[],https://github.com/chykoushik/Tumor-Identification-Python.git,1,0
Framework_SNN,Software Framework for SC-oriented Deep Convolution Neural Networks,M.Sc Junseok Oh,"Stuttgart, Deutschland",[],https://github.com/yjod22/Framework_SNN.git,1,0
nn-project,My project for the Neural Network course at the University of Tartu ,Robin Weitzel,Augsburg,[],https://github.com/RobinWeitzel/nn-project.git,1,0
SVM,This is a SVM(Support Vector Machine) for Machine Learning.,Hüseyin Hürkan KARAMAN,"Bonn, Deutschland","['machine-learning-algorithms', 'machinelearning', 'python', 'svm-training', 'svm']",https://github.com/maxmanus96/SVM.git,1,0
keras-machine-learning-framework-java-sources,These are the sources of the Framework https://github.com/bjoern-hempel/keras-machine-learning-framework.,Björn Hempel,Dresden,[],https://github.com/bjoern-hempel/keras-machine-learning-framework-java-sources.git,1,1
UNTIL-ClimateReboot-hackathon-,Machine learning R codes and IOT simulation codes,Akshay Dattatray Devkate,Essen,"['r', 'jupyter-notebook', 'simulation', 'iot', 'cpp']",https://github.com/AkshayDevkate/UNTIL-ClimateReboot-hackathon-.git,1,0
AdultsDataSetUCI,Machine Learning Techniques  to known dataset so as to predict the unknown income,,Potsdam,[],https://github.com/sefeoglu/AdultsDataSetUCI.git,1,0
Pattern-Recognition,This project made with MATLAB. It's about machine learning. Artificial Neural Network in the form of Multilayer Perceptron.,Hüseyin Hürkan KARAMAN,"Bonn, Deutschland","['matlab', 'machine-learning-algorithms', 'pattern-recognition', 'backpropagation-learning-algorithm', 'backpropagation', 'artifical-neural-network', 'multilayer-perceptron-network', 'multilayer-perceptron']",https://github.com/maxmanus96/Pattern-Recognition.git,1,0
WHOCares,"A machine learning project in R to understand the impact of various predictors like human population, CO2 emissions, Human population, and GDP on global temperatures",Ravi Gunti,Magdeburg,"['r', 'machine-learning', 'linear-regression', 'time-series']",https://github.com/rtgunti/WHOCares.git,1,0
neuro-evolutional-snake-legacy,A neural network learns to play Snake,Hadi Saleh,Mannheim,[],https://github.com/HadiSalehWeb/neuro-evolutional-snake-legacy.git,1,0
Simulated-image-data,"This is code for student project to Detection of logistic objects: ""Training of deep neural networks with simulated image data """,Karri Aravind,Kassel,[],https://github.com/playhard21/Simulated-image-data.git,1,0
